Date,Article title,Article sentiment
2024-06-23T12:44:05.000Z,"The Manitowoc Company, Inc. (NYSE:MTW) is a favorite amongst institutional investors who own 78%",NaN too long
2024-06-17T16:16:00.000Z,Manitowoc (MTW) Declines 35% YTD: What's Ailing the Stock?,NaN too long
None,The Manitowoc Company (MTW) Down 2.5% Since Last Earnings Report: Can It Rebound?,positive
None,"An Intrinsic Calculation For The Manitowoc Company, Inc. (NYSE:MTW) Suggests It's 26% Undervalued",positive
None,The Manitowoc Company to Participate in Investor Conferences,positive
None,Manitowoc Company First Quarter 2024 Earnings: EPS Misses Expectations,positive
None,International Markets and The Manitowoc Company (MTW): A Deep Dive for Investors,positive
None,"The Manitowoc Company, Inc. (NYSE:MTW) Q1 2024 Earnings Call Transcript",positive
